{
  "schema_version": "astrabridge-skill-to-graph-manifest-v1",
  "skill_id": "astrabridge.supervisor-worker-synthesizer",
  "version": "1.0.0",
  "kind": "orchestration_skill",
  "status": "candidate",
  "metadata": {
    "display_name": "Supervisor / Worker / Synthesizer",
    "description": "Bounded single-worker decomposition with typed artifact-first synthesis.",
    "tags": ["supervisor", "worker", "synthesis", "bounded"],
    "owners": ["astrabridge-core"],
    "notes": ["Canonical template only; no recursive runtime composition."]
  },
  "resolution": {
    "mode": "builtin_template",
    "graph_template_ref": "supervisor_worker_synthesizer",
    "graph_schema_version": "astrabridge-agent-orchestration-graph-v1",
    "parameter_schema": {
      "type": "object",
      "properties": {
        "task_goal": {"type": "string", "minLength": 1, "maxLength": 8000},
        "constraints": {"type": "array", "items": {"type": "string", "maxLength": 600}, "maxItems": 16},
        "worker_scope": {"type": "string", "minLength": 1, "maxLength": 4000}
      },
      "required": ["task_goal"],
      "additionalProperties": false
    },
    "bindings": [
      {"parameter": "task_goal", "graph_path": "input.task_context", "required": true},
      {"parameter": "constraints", "graph_path": "input.constraints", "required": false},
      {"parameter": "worker_scope", "graph_path": "nodes.node_worker.prompt", "required": false}
    ]
  },
  "prompt": {
    "mode": "reference",
    "template_ref": "prompt.supervisor_worker_synthesizer.v1",
    "variables_schema": {
      "type": "object",
      "properties": {
        "task_goal": {"type": "string"},
        "constraints": {"type": "array"},
        "worker_scope": {"type": "string"}
      },
      "required": ["task_goal"],
      "additionalProperties": false
    }
  },
  "contracts": {
    "input": {
      "schema_ref": "schema.skill_supervisor_input",
      "required_message_parts": ["text"],
      "artifact_specs": []
    },
    "output": {
      "schema_ref": "schema.synthesis_result",
      "required_message_parts": ["machine_result", "human_summary", "artifact_ref"],
      "artifact_specs": [
        {"kind": "text_report", "id": "worker_report"},
        {"kind": "run_summary", "id": "final_summary"}
      ]
    }
  },
  "policies": {
    "routing": {
      "selection_mode": "bounded_pool",
      "allowed_provider_ids": ["qwen", "kimi"],
      "allowed_model_ids": ["qwen3.7-plus", "qwen3-coder-plus", "kimi-k2.6"],
      "fallback_mode": "catalog_verified",
      "required_capabilities": ["text", "structured_json"]
    },
    "mcp": {
      "preset_ids": ["astrabridge_workspace", "astrabridge_web"],
      "tool_rules": [
        {"server": "astrabridge_workspace", "tools": ["astrabridge_workspace_read_file"], "approval_mode": "allow", "effect_class": "read_only", "max_calls": 16},
        {"server": "astrabridge_web", "tools": ["astrabridge_web_search_batch", "astrabridge_web_research_brief"], "approval_mode": "allow", "effect_class": "network_read", "max_calls": 8}
      ],
      "approval_mode": "ask",
      "loopback_allowed": true
    },
    "communication": {
      "history_mode": "latest_summary_only",
      "artifact_mode": "required_output_only",
      "exclude_private_memory": true,
      "include_machine_results": true,
      "include_human_summaries": true,
      "allow_direct_teammate_messages": false
    },
    "subagent": {
      "isolation_mode": "lane",
      "max_turns": 8,
      "allow_nested_subagents": false,
      "allow_direct_teammate_messages": false
    },
    "budget": {
      "max_total_agents": 3,
      "max_parallel_agents": 1,
      "max_total_tokens": 60000,
      "max_provider_calls": 3,
      "max_retries": 1,
      "provider_concurrency": [
        {"provider_id": "qwen", "max_active_agents": 1},
        {"provider_id": "kimi", "max_active_agents": 1}
      ],
      "model_concurrency": [
        {"provider_id": "qwen", "model_id": "qwen3.7-plus", "max_active_agents": 1},
        {"provider_id": "kimi", "model_id": "kimi-k2.6", "max_active_agents": 1}
      ]
    },
    "approval": {
      "default_mode": "ask",
      "risky_effects_require_approval": ["provider_call", "file_write", "external_write"]
    },
    "a2a": {
      "external_enabled": false,
      "allowed_card_refs": [],
      "minimum_trust_level": "workspace_trusted",
      "gateway_required": true
    }
  },
  "composition": {
    "allow_runtime_nesting": false,
    "max_expansion_depth": 1,
    "template_refs": []
  },
  "compatibility": {
    "graph_schema_version": "astrabridge-agent-orchestration-graph-v1",
    "min_runtime_version": "0.1.0",
    "legacy_sources": ["astrabridge-task-graph-v1"],
    "migration_notes": ["Legacy task-graph lowering is compatibility-only; the canonical graph remains authoritative."]
  },
  "evidence": {
    "required_level": "productized",
    "fixture_ref": "fixture.supervisor_worker_synthesizer",
    "artifact_root": "PRIVATE/skill-first-orchestration/step6-skill-templates/"
  },
  "extensions": {
    "taxonomy_version": "astrabridge-skill-template-taxonomy-v1",
    "template_id": "supervisor_worker_synthesizer",
    "mcp_resolution": "astrabridge_workspace is a declared workspace-MCP dependency; availability is checked before product promotion."
  }
}
